<?xml version="1.0" encoding="UTF-8"?>
<dbear:dBEAR xmlns:dbear="http://www.flancer64.com/dBEAR/Schema" xmlns:xsi="http://www.w3.org/2001/XMLSchema-instance"
             xsi:schemaLocation="http://www.flancer64.com/dBEAR/Schema ../../xsd/dem_1.0.0.xsd ">
    <dbear:comment>Second iteration in the domain data development.</dbear:comment>
    <dbear:namespaces>
        <dbear:namespace id="com.flancer32.dbear.sample.core">
            <dbear:comment>Add attribute to the existing Entity.</dbear:comment>
            <dbear:entities>
                <dbear:entity id="Person">
                    <dbear:attributes>
                        <dbear:attribute id="Gender">
                            <dbear:type>
                                <dbear:text>
                                    <dbear:isNullable>false</dbear:isNullable>
                                    <dbear:isUnique>false</dbear:isUnique>
                                    <dbear:length>1</dbear:length>
                                </dbear:text>
                            </dbear:type>
                        </dbear:attribute>
                    </dbear:attributes>
                </dbear:entity>
            </dbear:entities>
        </dbear:namespace>
        <dbear:namespace id="com.flancer32.dbear.sample.auth">
            <dbear:comment>Another namespace with authentication related entities.</dbear:comment>
            <dbear:entities>
                <dbear:entity id="AuthMethod">
                    <dbear:comment>Authentication methods can be used in the current application (username and password, SMS code, etc.).</dbear:comment>
                    <dbear:attributes>
                        <dbear:attribute id="Name">
                            <dbear:type>
                                <dbear:text/>
                            </dbear:type>
                        </dbear:attribute>
                    </dbear:attributes>
                </dbear:entity>
            </dbear:entities>
            <dbear:relations>
                <dbear:relation id="Person_AuthMethod">
                    <dbear:comment>Each Person can be authenticated by one ore more methods.</dbear:comment>
                    <dbear:refs>
                        <dbear:entryRef>
                            <dbear:id>AuthMethod</dbear:id>
                        </dbear:entryRef>
                        <dbear:entryRef>
                            <dbear:namespace>com.flancer32.dbear.sample.core</dbear:namespace>
                            <dbear:id>Person</dbear:id>
                            <!-- Uncomment unique index to allow one only authentication method per person. -->
                            <dbear:indexes>
                                <dbear:index id="UniquePerson">
                                    <dbear:comment>One only Method per Person is allowed.</dbear:comment>
                                </dbear:index>
                            </dbear:indexes>
                        </dbear:entryRef>
                    </dbear:refs>
                </dbear:relation>
            </dbear:relations>
        </dbear:namespace>
    </dbear:namespaces>
</dbear:dBEAR>